{
  "id": "organic-community-grounds-communitarianism",
  "ground": { "axisId": "SOCIAL_CONTRACT", "poleId": "ORGANIC_COMMUNITY" },
  "grounded": { "axisId": "BELONGING", "poleId": "COMMUNITARIANISM" },
  "kind": "T_V",
  "strength": "MEDIUM",
  "explanation": {
    "fr": "Si la communauté précède l'individu et le constitue, alors la loyauté envers les siens n'est pas un préjugé à surmonter mais une part de ce que nous sommes. La conception organique du lien social fonde le communautarisme : nos attaches concrètes, famille, culture, nation, sont la source réelle de la solidarité, comme le soutient le courant communautarien, tel MacIntyre.",
    "en": "If the community precedes the individual and constitutes them, then loyalty to one's own is not a prejudice to overcome but a part of what we are. The organic conception of the social bond grounds communitarianism: our concrete attachments, family, culture, nation, are the real source of solidarity, as the communitarian current, such as MacIntyre, maintains."
  },
  "updatedAt": "2026-06-21T00:00:00.000Z"
}
