{
  "id": "tragic-thought-grounds-lucidity-without-hope",
  "ground": { "axisId": "COSMIC_OUTLOOK", "poleId": "TRAGIC_THOUGHT" },
  "grounded": { "axisId": "HOPE", "poleId": "LUCIDITY_WITHOUT_HOPE" },
  "kind": "T_V",
  "strength": "STRONG",
  "explanation": {
    "fr": "Si le monde n'est ni rationnel ni bienveillant et qu'aucune harmonie finale ne rachètera la souffrance, alors espérer, c'est se mentir. La pensée tragique fonde la lucidité sans espoir : <ph id='camus'>Camus</ph> tient la révolte lucide, sans consolation, pour plus digne que l'espérance, et y trouve une forme de liberté.",
    "en": "If the world is neither rational nor benevolent and no final harmony will redeem suffering, then to hope is to lie to oneself. Tragic thought grounds lucidity without hope: <ph id='camus'>Camus</ph> holds lucid revolt, without consolation, to be worthier than hope, and finds in it a form of freedom."
  },
  "updatedAt": "2026-06-21T00:00:00.000Z"
}
