{
  "id": "tragic-thought-grounds-aestheticism",
  "ground": { "axisId": "COSMIC_OUTLOOK", "poleId": "TRAGIC_THOUGHT" },
  "grounded": { "axisId": "AESTHETIC_LIFE", "poleId": "AESTHETICISM" },
  "kind": "T_V",
  "strength": "STRONG",
  "explanation": {
    "fr": "Si le monde est sans ordre ni justice et qu'aucun sens ne lui est donné, la beauté reste la seule manière d'en racheter l'horreur et d'y consentir. La pensée tragique fonde l'esthétisme : <ph id='nietzsche'>Nietzsche</ph> tient que c'est seulement comme phénomène esthétique que l'existence est justifiée, et fait de la vie même une œuvre à créer.",
    "en": "If the world is without order or justice and no meaning is given to it, beauty remains the only way to redeem its horror and to consent to it. Tragic thought grounds aestheticism: <ph id='nietzsche'>Nietzsche</ph> holds that it is only as an aesthetic phenomenon that existence is justified, and makes life itself a work to be created."
  },
  "updatedAt": "2026-06-22T00:00:00.000Z"
}
