{
  "id": "theism-grounds-immortal-soul",
  "ground": { "axisId": "GOD_EXISTENCE", "poleId": "THEISM" },
  "grounded": { "axisId": "AFTERLIFE", "poleId": "IMMORTAL_SOUL" },
  "kind": "T_T",
  "strength": "MEDIUM",
  "explanation": {
    "fr": "Si un Dieu personnel et juste existe, l'espérance d'une âme qui survit à la mort et reçoit son jugement devient cohérente. Le théisme soutient ainsi la croyance en une survie de la personne, pour laquelle la mort n'est pas l'anéantissement définitif.",
    "en": "If a personal and just God exists, the hope of a soul that survives death and receives his judgement becomes coherent. Theism thus supports belief in the person's survival, for which death is not final annihilation."
  },
  "updatedAt": "2026-07-20T00:00:00.000Z"
}
