{
  "id": "essentialism-grounds-eudaimonism",
  "ground": { "axisId": "ESSENCE", "poleId": "ESSENTIALISM" },
  "grounded": { "axisId": "SOVEREIGN_GOOD", "poleId": "EUDAIMONISM" },
  "kind": "T_V",
  "strength": "STRONG",
  "explanation": {
    "fr": "Si l'être humain a une nature propre, une fonction qui le définit, sa vie est bonne lorsqu'elle accomplit pleinement cette fonction. L'essentialisme fonde l'eudémonisme : <ph id='aristotle'>Aristote</ph> tire le souverain bien de la fonction propre de l'homme, l'exercice excellent de la raison, dont le plaisir n'est que l'accompagnement.",
    "en": "If the human being has a proper nature, a function that defines it, then a life is good when it fully accomplishes that function. Essentialism grounds eudaimonism: <ph id='aristotle'>Aristotle</ph> draws the highest good from man's proper function, the excellent exercise of reason, of which pleasure is only the accompaniment."
  },
  "updatedAt": "2026-06-21T00:00:00.000Z"
}
