{
  "id": "theism-grounds-agape",
  "ground": { "axisId": "GOD_EXISTENCE", "poleId": "THEISM" },
  "grounded": { "axisId": "LOVE_NATURE", "poleId": "AGAPE_AS_GIFT" },
  "kind": "T_T",
  "strength": "MEDIUM",
  "explanation": {
    "fr": "Si Dieu existe et se définit comme amour, alors l'amour le plus haut est un don gratuit, à l'image du sien : il se donne sans rien attendre en retour. Le théisme fonde l'agapè : le christianisme oppose à l'éros qui désire et qui manque la charité qui s'adresse à l'autre pour lui-même.",
    "en": "If God exists and defines himself as love, then the highest love is a free gift, in his image: it gives itself expecting nothing in return. Theism grounds agape: Christianity sets against the eros that desires and lacks the charity that is directed at the other for their own sake."
  },
  "updatedAt": "2026-06-22T00:00:00.000Z"
}
