{
  "id": "culturalism-grounds-social-construction",
  "ground": { "axisId": "HUMAN_NATURE", "poleId": "CULTURALISM" },
  "grounded": { "axisId": "SOCIAL_IDENTITY", "poleId": "SOCIAL_CONSTRUCTION" },
  "kind": "T_T",
  "strength": "STRONG",
  "explanation": {
    "fr": "Si ce que nous prenons pour la nature humaine varie d'une société à l'autre, alors les catégories qui nous classent, le genre au premier chef, sont des produits de l'histoire et non des donnés de nature. Le culturalisme fonde le constructionnisme social : <ph id='beauvoir'>Beauvoir</ph> résume que « on ne naît pas femme, on le devient ».",
    "en": "If what we take for human nature varies from one society to another, then the categories that classify us, gender first of all, are products of history and not natural givens. Culturalism grounds social construction: <ph id='beauvoir'>Beauvoir</ph> sums it up: \"one is not born, but rather becomes, a woman\"."
  },
  "updatedAt": "2026-06-21T00:00:00.000Z"
}
