{
  "id": "dualism-grounds-substance-dualism",
  "ground": { "axisId": "REALITY_NATURE", "poleId": "DUALISM" },
  "grounded": { "axisId": "CONSCIOUSNESS_NATURE", "poleId": "SUBSTANCE_DUALISM" },
  "kind": "T_T",
  "strength": "STRONG",
  "explanation": {
    "fr": "Si la réalité comprend deux substances irréductibles, la matière étendue et la pensée, alors ma conscience relève de la seconde : elle n'est pas le cerveau, mais une réalité d'une autre nature. Le dualisme métaphysique fonde directement le dualisme des substances en philosophie de l'esprit, dont <ph id='descartes'>Descartes</ph> donne la formulation classique.",
    "en": "If reality comprises two irreducible substances, extended matter and thought, then my consciousness belongs to the second: it is not the brain but a reality of another nature. Metaphysical dualism directly grounds substance dualism in the philosophy of mind, of which <ph id='descartes'>Descartes</ph> gives the classic formulation."
  },
  "updatedAt": "2026-06-21T00:00:00.000Z"
}
